{
  "schemaVersion": 1,
  "id": "122",
  "drawNumber": 122,
  "date": "2026-02-01",
  "source": {
    "name": "Bangladesh Bank",
    "url": "https://www.bb.org.bd/en/index.php/investfacility/prizebond",
    "pdf": "source/draw-122-2026-02-01.pdf",
    "extractedAt": "2026-10-12T00:20:00Z"
  },
  "tiers": [
    {
      "tier": 1,
      "amount": 600000,
      "expectedCount": 1,
      "numbers": [
        "0017777"
      ]
    },
    {
      "tier": 2,
      "amount": 325000,
      "expectedCount": 1,
      "numbers": [
        "0480133"
      ]
    },
    {
      "tier": 3,
      "amount": 100000,
      "expectedCount": 2,
      "numbers": [
        "0766338",
        "0939930"
      ]
    },
    {
      "tier": 4,
      "amount": 50000,
      "expectedCount": 2,
      "numbers": [
        "0100001",
        "0395408"
      ]
    },
    {
      "tier": 5,
      "amount": 10000,
      "expectedCount": 40,
      "numbers": [
        "0018932",
        "0039281",
        "0067182",
        "0108392",
        "0138291",
        "0178392",
        "0218932",
        "0248912",
        "0289123",
        "0328912",
        "0358912",
        "0398912",
        "0438912",
        "0478912",
        "0518912",
        "0558912",
        "0598912",
        "0638912",
        "0678912",
        "0718912",
        "0758912",
        "0798912",
        "0838912",
        "0878912",
        "0918912",
        "0958912",
        "0998912",
        "0028912",
        "0058912",
        "0098912",
        "0128912",
        "0168912",
        "0208912",
        "0238912",
        "0278912",
        "0318912",
        "0348912",
        "0388912",
        "0428912",
        "0468912"
      ]
    }
  ]
}
